{
  "schema_version": "0.1.0",
  "benchmark_version": "0.1.0",
  "model": {
    "id": "nvidia/nemotron-3-ultra-550b-a55b",
    "endpoint": "http://localhost:8000/v1",
    "reasoning_budget": 1024,
    "reasoning_budget_parameter": "thinking_token_budget",
    "max_tokens": 1536,
    "temperature": 0.7
  },
  "proposal": {
    "proposer_count": 3,
    "beam_width": 5,
    "timeout_ms": 120000
  },
  "retry": {
    "max_attempts": 3,
    "base_delay_ms": 250,
    "max_delay_ms": 4000
  },
  "benchmark": {
    "seed": 42,
    "max_turns": 8,
    "task_timeout_ms": 300000,
    "transport": "in_process"
  }
}
